{
  "schemaVersion": 1,
  "methodology": "project-transparency/1",
  "repositoryName": "TuiVision",
  "timeZone": "UTC",
  "activityWindowWeeks": 52,
  "excludedPaths": ["Directory.Build.props"],
  "categoryOverrides": [],
  "phases": [],
  "references": {
    "enabled": false,
    "scenarios": []
  }
}
